{
  "schemaVersion": "0.2.2",
  "song": {
    "songId": "pak_-_night",
    "title": "PAK - Night",
    "artist": "Unknown",
    "bpm": 170.0000850000425,
    "resolution": 480,
    "timeSignature": "4/4",
    "durationMs": 238588,
    "audioFile": "PAK - Night.wav",
    "audioOffsetMs": 0
  },
  "track": {
    "trackId": "guitar_normal",
    "instrument": "guitar",
    "difficulty": "normal",
    "tuning": [
      "E2",
      "A2",
      "D3",
      "G3",
      "B3",
      "E4"
    ],
    "chordDefinitions": [
      {
        "id": "G5",
        "symbol": "G5",
        "fingering": [
          {
            "string": 5,
            "fret": 5,
            "finger": 3
          },
          {
            "string": 6,
            "fret": 3,
            "finger": 1
          }
        ]
      },
      {
        "id": "C5",
        "symbol": "C5",
        "fingering": [
          {
            "string": 5,
            "fret": 3,
            "finger": 1
          },
          {
            "string": 4,
            "fret": 5,
            "finger": 3
          }
        ]
      },
      {
        "id": "D5",
        "symbol": "D5",
        "fingering": [
          {
            "string": 5,
            "fret": 5,
            "finger": 1
          },
          {
            "string": 4,
            "fret": 7,
            "finger": 3
          }
        ]
      },
      {
        "id": "A5",
        "symbol": "A5",
        "fingering": [
          {
            "string": 5,
            "fret": 0,
            "finger": 0
          },
          {
            "string": 4,
            "fret": 2,
            "finger": 1
          }
        ]
      },
      {
        "id": "E5_high",
        "symbol": "E5",
        "fingering": [
          {
            "string": 5,
            "fret": 7,
            "finger": 1
          },
          {
            "string": 4,
            "fret": 9,
            "finger": 3
          }
        ]
      },
      {
        "id": "B5",
        "symbol": "B5",
        "fingering": [
          {
            "string": 5,
            "fret": 2,
            "finger": 1
          },
          {
            "string": 4,
            "fret": 4,
            "finger": 3
          }
        ]
      },
      {
        "id": "E5_low",
        "symbol": "E5",
        "fingering": [
          {
            "string": 6,
            "fret": 0,
            "finger": 0
          },
          {
            "string": 5,
            "fret": 2,
            "finger": 1
          }
        ]
      },
      {
        "id": "D#",
        "symbol": "D#",
        "fingering": [
          {
            "string": 5,
            "fret": 6,
            "finger": 1
          },
          {
            "string": 4,
            "fret": 7,
            "finger": 3
          }
        ]
      },
      {
        "id": "D#",
        "symbol": "D#",
        "fingering": [
          {
            "string": 5,
            "fret": 6,
            "finger": 1
          },
          {
            "string": 4,
            "fret": 7,
            "finger": 3
          }
        ]
      },
      {
        "id": "C#dim",
        "symbol": "C#dim",
        "fingering": [
          {
            "string": 5,
            "fret": 4,
            "finger": 1
          },
          {
            "string": 4,
            "fret": 5,
            "finger": 2
          }
        ]
      }
    ]
  },
  "notes": [
    {
      "interpretation": "chord",
      "startTick": 17280,
      "durationTick": 480,
      "chordId": "G5",
      "strumTechnique": "down"
    },
    {
      "interpretation": "chord",
      "startTick": 17760,
      "durationTick": 480,
      "chordId": "G5",
      "strumTechnique": "down"
    },
    {
      "interpretation": "chord",
      "startTick": 18240,
      "durationTick": 240,
      "chordId": "G5",
      "strumTechnique": "down"
    },
    {
      "interpretation": "chord",
      "startTick": 18480,
      "durationTick": 240,
      "chordId": "G5",
      "strumTechnique": "down"
    },
    {
      "interpretation": "chord",
      "startTick": 18720,
      "durationTick": 240,
      "chordId": "G5",
      "strumTechnique": "down"
    },
    {
      "interpretation": "chord",
      "startTick": 18960,
      "durationTick": 480,
      "chordId": "G5",
      "strumTechnique": "down"
    },
    {
      "interpretation": "chord",
      "startTick": 19440,
      "durationTick": 240,
      "chordId": "G5",
      "strumTechnique": "down"
    },
    {
      "interpretation": "chord",
      "startTick": 19680,
      "durationTick": 240,
      "chordId": "G5",
      "strumTechnique": "down"
    },
    {
      "interpretation": "chord",
      "startTick": 19920,
      "durationTick": 480,
      "chordId": "G5",
      "strumTechnique": "down"
    },
    {
      "interpretation": "chord",
      "startTick": 20400,
      "durationTick": 240,
      "chordId": "G5",
      "strumTechnique": "down"
    },
    {
      "interpretation": "chord",
      "startTick": 20640,
      "durationTick": 240,
      "chordId": "G5",
      "strumTechnique": "down"
    },
    {
      "interpretation": "chord",
      "startTick": 20880,
      "durationTick": 240,
      "chordId": "G5",
      "strumTechnique": "down"
    },
    {
      "interpretation": "chord",
      "startTick": 21120,
      "durationTick": 480,
      "chordId": "G5",
      "strumTechnique": "down"
    },
    {
      "interpretation": "chord",
      "startTick": 21600,
      "durationTick": 480,
      "chordId": "G5",
      "strumTechnique": "down"
    },
    {
      "interpretation": "chord",
      "startTick": 22080,
      "durationTick": 240,
      "chordId": "G5",
      "strumTechnique": "down"
    },
    {
      "interpretation": "chord",
      "startTick": 22320,
      "durationTick": 240,
      "chordId": "G5",
      "strumTechnique": "down"
    },
    {
      "interpretation": "chord",
      "startTick": 22560,
      "durationTick": 240,
      "chordId": "G5",
      "strumTechnique": "down"
    },
    {
      "interpretation": "chord",
      "startTick": 22800,
      "durationTick": 480,
      "chordId": "G5",
      "strumTechnique": "down"
    },
    {
      "interpretation": "chord",
      "startTick": 23280,
      "durationTick": 240,
      "chordId": "G5",
      "strumTechnique": "down"
    },
    {
      "interpretation": "chord",
      "startTick": 23520,
      "durationTick": 240,
      "chordId": "G5",
      "strumTechnique": "down"
    },
    {
      "interpretation": "chord",
      "startTick": 23760,
      "durationTick": 480,
      "chordId": "G5",
      "strumTechnique": "down"
    },
    {
      "interpretation": "chord",
      "startTick": 24240,
      "durationTick": 240,
      "chordId": "G5",
      "strumTechnique": "down"
    },
    {
      "interpretation": "chord",
      "startTick": 24480,
      "durationTick": 240,
      "chordId": "G5",
      "strumTechnique": "down"
    },
    {
      "interpretation": "chord",
      "startTick": 24720,
      "durationTick": 240,
      "chordId": "G5",
      "strumTechnique": "down"
    },
    {
      "interpretation": "chord",
      "startTick": 24960,
      "durationTick": 480,
      "chordId": "C5",
      "strumTechnique": "down"
    },
    {
      "interpretation": "chord",
      "startTick": 25440,
      "durationTick": 480,
      "chordId": "C5",
      "strumTechnique": "down"
    },
    {
      "interpretation": "chord",
      "startTick": 25920,
      "durationTick": 240,
      "chordId": "C5",
      "strumTechnique": "down"
    },
    {
      "interpretation": "chord",
      "startTick": 26160,
      "durationTick": 240,
      "chordId": "C5",
      "strumTechnique": "down"
    },
    {
      "interpretation": "chord",
      "startTick": 26400,
      "durationTick": 240,
      "chordId": "C5",
      "strumTechnique": "down"
    },
    {
      "interpretation": "chord",
      "startTick": 26640,
      "durationTick": 480,
      "chordId": "C5",
      "strumTechnique": "down"
    },
    {
      "interpretation": "chord",
      "startTick": 27120,
      "durationTick": 240,
      "chordId": "C5",
      "strumTechnique": "down"
    },
    {
      "interpretation": "chord",
      "startTick": 27360,
      "durationTick": 240,
      "chordId": "C5",
      "strumTechnique": "down"
    },
    {
      "interpretation": "chord",
      "startTick": 27600,
      "durationTick": 480,
      "chordId": "C5",
      "strumTechnique": "down"
    },
    {
      "interpretation": "chord",
      "startTick": 28080,
      "durationTick": 240,
      "chordId": "C5",
      "strumTechnique": "down"
    },
    {
      "interpretation": "chord",
      "startTick": 28320,
      "durationTick": 240,
      "chordId": "C5",
      "strumTechnique": "down"
    },
    {
      "interpretation": "chord",
      "startTick": 28560,
      "durationTick": 240,
      "chordId": "C5",
      "strumTechnique": "down"
    },
    {
      "interpretation": "chord",
      "startTick": 28800,
      "durationTick": 480,
      "chordId": "D5",
      "strumTechnique": "down"
    },
    {
      "interpretation": "chord",
      "startTick": 29280,
      "durationTick": 480,
      "chordId": "D5",
      "strumTechnique": "down"
    },
    {
      "interpretation": "chord",
      "startTick": 29760,
      "durationTick": 240,
      "chordId": "D5",
      "strumTechnique": "down"
    },
    {
      "interpretation": "chord",
      "startTick": 30000,
      "durationTick": 240,
      "chordId": "D5",
      "strumTechnique": "down"
    },
    {
      "interpretation": "chord",
      "startTick": 30240,
      "durationTick": 240,
      "chordId": "D5",
      "strumTechnique": "down"
    },
    {
      "interpretation": "chord",
      "startTick": 30480,
      "durationTick": 480,
      "chordId": "D5",
      "strumTechnique": "down"
    },
    {
      "interpretation": "chord",
      "startTick": 30960,
      "durationTick": 240,
      "chordId": "D5",
      "strumTechnique": "down"